<?xml version="1.0" encoding="UTF-8" ?>

<tv_programs 
        xmlns="https://www.w3schools.com"
        xmlns:xsi="http://www.w3.org/2001/XMLSchema-instance"
        xsi:schemaLocation="https://www.w3schools.com schema-definition.xsd">
    <tv_program>
        <show>
            <title>Черно зеркало</title>
            <genre>Научна фантастика, Трилър</genre>
            <description>Сериал, изследващ тъмната страна на технологията и нейното влияние върху обществото.</description>
            <episode>
                <episode_number>1</episode_number>
                <air_date>2011-12-04</air_date>
                <actors>
                    <actor>
                        <name>Брайс Далас Хауърд</name>
                        <role>Лейси Паунд</role>
                    </actor>
                    <actor>
                        <name>Алекс Лоутър</name>
                        <role>Кени</role>
                    </actor>
                </actors>
            </episode>
            <episode>
                <episode_number>2</episode_number>
                <air_date>2011-12-11</air_date>
                <actors>
                    <actor>
                        <name>Джоди Уитакър</name>
                        <role>Фифи</role>
                    </actor>
                    <actor>
                        <name>Топър Грейс</name>
                        <role>Джон Бийкър</role>
                    </actor>
                </actors>
            </episode>
        </show>
    </tv_program>
</tv_programs>