<?xml version="1.0" encoding="UTF-8" ?>

<tv_programs 
        xmlns="https://www.w3schools.com"
        xmlns:xsi="http://www.w3.org/2001/XMLSchema-instance"
        xsi:schemaLocation="https://www.w3schools.com schema-definition.xsd">
    <tv_program>
        <show>
            <title>Шерлок</title>
            <genre>Детектив, Криминален</genre>
            <description>Съвременна адаптация на приключенията на Шерлок Холмс и д-р Джон Уотсън.</description>
            <episode>
                <episode_number>1</episode_number>
                <air_date>2010-07-25</air_date>
                <actors>
                    <actor>
                        <name>Бенедикт Къмбърбач</name>
                        <role>Шерлок Холмс</role>
                    </actor>
                    <actor>
                        <name>Мартин Фрийман</name>
                        <role>Джон Уотсън</role>
                    </actor>
                </actors>
            </episode>
            <episode>
                <episode_number>2</episode_number>
                <air_date>2010-08-01</air_date>
                <actors>
                    <actor>
                        <name>Андрю Скот</name>
                        <role>Мориарти</role>
                    </actor>
                    <actor>
                        <name>Уна Стъбс</name>
                        <role>Госпожа Хъдсън</role>
                    </actor>
                </actors>
            </episode>
        </show>
    </tv_program>
</tv_programs>