<?xml version="1.0" encoding="UTF-8" ?>

<tv_programs 
        xmlns="https://www.w3schools.com"
        xmlns:xsi="http://www.w3.org/2001/XMLSchema-instance"
        xsi:schemaLocation="https://www.w3schools.com schema-definition.xsd">
    <tv_program>
        <show>
            <title>Игра на тронове</title>
            <genre>Фентъзи, Драма</genre>
            <description>Политически и династични борби сред благородни фамилии в Седемте кралства на Вестерос.</description>
            <episode>
                <episode_number>1</episode_number>
                <air_date>2011-04-17</air_date>
                <actors>
                    <actor>
                        <name>Емилия Кларк</name>
                        <role>Дейенерис Таргариен</role>
                    </actor>
                    <actor>
                        <name>Кит Харингтън</name>
                        <role>Джон Сноу</role>
                    </actor>
                </actors>
            </episode>
            <episode>
                <episode_number>2</episode_number>
                <air_date>2011-04-24</air_date>
                <actors>
                    <actor>
                        <name>Лина Хийди</name>
                        <role>Серсеи Ланистър</role>
                    </actor>
                    <actor>
                        <name>Николай Костер-Валдау</name>
                        <role>Джейме Ланистър</role>
                    </actor>
                </actors>
            </episode>
        </show>
    </tv_program>
</tv_programs>
